{
  "$schema": "./json-devices-schema.json",
  "SystemId": "System1",
  "HostConfigurations": {
    "ImageStorage": {
      "LocalFallbackPath": "ScanBackup",
      "DirectBufferCapacityFrames": 50,
      "LocalSpoolBufferCapacityFrames": 50
    },
    "SessionControl": {
      "SessionTimeoutSeconds": 30,
      "CleanupIntervalSeconds": 1
    },
    "CameraStreams": {
      "Cameras": [
        {
          "ServiceId": "camera.front.ImageStream",
          "DisplayName": "Front camera",
          "Enabled": true,
          "DeviceIndex": 0,
          "Backend": "DirectShow",
          "Width": 640,
          "Height": 480,
          "FramesPerSecond": 10,
          "JpegQuality": 80
        },
        {
          "ServiceId": "camera.rear.ImageStream",
          "DisplayName": "Rear camera",
          "Enabled": false,
          "DeviceIndex": 1,
          "Backend": "DirectShow",
          "Width": 640,
          "Height": 480,
          "FramesPerSecond": 10,
          "JpegQuality": 80
        }
      ]
    },
    "DetectorStreams": {
      "Raw": {
        "MemoryBufferCapacityFrames": 50,
        "SpoolWriteQueueCapacityFrames": 50
      },
      "Preview": {
        "Enabled": true,
        "Encoder": "NvencH264",
        "Quality": 80,
        "MaxFramesPerSecond": 30,
        "Nvenc": {
          "DirectCudaInput": true,
          "TargetBitRateMbps": 20,
          "MaximumBitRateMbps": 30,
          "GopLengthFrames": 30
        }
      },
      "Lossless": {
        "Enabled": false,
        "Compression": "Zstd",
        "CompressionLevel": 3,
        "IncludeChecksum": true
      }
    },
    "XFlowProvider": {
      "Enabled": true,
      "AllowExecutionWithoutControlLease": false,
      "Address": "http://127.0.0.1:5001",
      "DelegatedControlAddress": "127.0.0.1:5070",
      "InstanceId": "",
      "IdentityFilePath": "",
      "DisplayName": "XTom Server",
      "MaxConcurrency": 1
    }
  },
  "Assemblies": [
    {
      "Assembly": "DLLs\\TestDetector.dll",
      "Type": "TestDetector.TestDetectorCreator",
      "Alias": "DetectorTest"
    },
    {
      "Assembly": "DLLs\\DetectorSpectrumLogic.dll",
      "Type": "DetectorSpectrumLogic.DetectorSpectrumLogicCreator",
      "Alias": "DetectorSL"
    },
    {
      "Assembly": "DetectorIRay.dll",
      "Type": "DetectorIRay.DetectorIRayCreator",
      "Alias": "DetectorIRay"
    },
    {
      "Assembly": "DLLs\\TestSource.dll",
      "Type": "TestSource.TestSourceCreator",
      "Alias": "TestSource"
    },
    {
      "Assembly": "DLLs\\SourceHamamatsu.dll",
      "Type": "SourceHamamatsu.HamamatsuSourceCreator",
      "Alias": "HamamatsuL9181"
    },
    {
      "Assembly": "DLLs\\SourceXRAYWorX.dll",
      "Type": "SourceXRAYWorX.XRAYWorXSourceCreator",
      "Alias": "SourceXRAYWorX"
    },
    {
      "Assembly": "DLLs\\TestStage.dll",
      "Type": "TestStage.TestStageCreator",
      "Alias": "TestStage"
    },
    {
      "Assembly": "DLLs\\StageBR.dll",
      "Type": "StageBR.BrStageCreator",
      "Alias": "StageBR"
    },
    {
      "Assembly": "DLLs\\StageBR.dll",
      "Type": "StageBR.BrAxisCreator",
      "Alias": "BrAxis"
    },
    {
      "Assembly": "DLLs\\XTomServer.OpcUa.dll",
      "Type": "XTomServer.OpcUa.OpcUaConnectionCreator",
      "Alias": "OpcUaConnection"
    },
    {
      "Assembly": "DLLs\\XTomServer.OpcUa.dll",
      "Type": "XTomServer.OpcUa.OpcUaParameterCreator",
      "Alias": "OpcUaParameters"
    }
  ],
  "SystemDevices": [
    {
      "$type": "OpcUaConnection",
      "DeviceId": "BrPlc",
      "RemoteAccess": "None",
      "EndpointUrl": "opc.tcp://192.168.26.251:4840",
      "SecurityMode": "None",
      "SecurityPolicyUri": "http://opcfoundation.org/UA/SecurityPolicy#None",
      "AuthenticationMode": "Anonymous",
      "UserName": "",
      "Password": "",
      "AutoAcceptUntrustedCertificates": true,
      "NamespaceIndex": 5
    }
  ],
  "AxesConfiguration": {
    "AxisNodes": [
      {
        "NodeId": "MainNode",
        "CollisionActors": [
          {
            "$type": "CollisionBox",
            "ActorId": "CollisionBoxMain",
            "MinX": -0.1,
            "MaxX": 0.1,
            "MinY": -200.0,
            "MaxY": 0.0,
            "MinZ": -130.0,
            "MaxZ": 150.0,
            "IsStatic": false
          },
          {
            "$type": "CollisionBox",
            "ActorId": "CollisionBoxSource",
            "MinX": -100.0,
            "MaxX": 100.0,
            "MinY": -100.0,
            "MaxY": 300.0,
            "MinZ": -100.0,
            "MaxZ": 0.0,
            "IsStatic": true
          }
        ]
      },
      {
        "NodeId": "DetectorNode",
        "CollisionActors": [
          {
            "$type": "CollisionBox",
            "ActorId": "CollisionBoxDetector",
            "MinX": -200.0,
            "MaxX": 200.0,
            "MinY": -200.0,
            "MaxY": 200.0,
            "MinZ": -100.0,
            "MaxZ": 600.0,
            "IsStatic": false
          }
        ]
      }
    ],
    "StageControllers": [
      {
        "$type": "TestStage",
        "DeviceId": "StageController"
      },
      {
        "$type": "StageBR",
        "DeviceId": "StageController_BR",
        "ConnectionId": "BrPlc"
      }
    ],
    "Axes": [
      {
        "$type": "BrAxis",
        "DeviceId": "Spec_TransZ",
        "ControllerId": "StageController_BR",
        "AxisNodeId": "MainNode",
        "AxisName": "STZ",
        "RefMode": "Default",
        "Movement": "TransZ",
        "DefaultVelocity": 20,
        "DefaultAcceleration": 40,
        "LimMin": -1364.2,
        "LimMax": -764.2,
        "GlobalRef": 1364.2
      },
      {
        "$type": "BrAxis",
        "DeviceId": "Spec_TransX",
        "ControllerId": "StageController_BR",
        "AxisNodeId": "MainNode",
        "AxisName": "STX",
        "RefMode": "Default",
        "Movement": "TransX",
        "MoveAfterInit": 177.30,
        "DefaultVelocity": 10,
        "DefaultAcceleration": 10,
        "LimMin": 0.0,
        "LimMax": 345,
        "GlobalRef": -177.30
      },
      {
        "$type": "BrAxis",
        "DeviceId": "Det_TransZ",
        "ControllerId": "StageController_BR",
        "AxisNodeId": "DetectorNode",
        "AxisName": "DTZ",
        "RefMode": "Default",
        "Movement": "TransZ",
        "DefaultVelocity": 20,
        "DefaultAcceleration": 40,
        "LimMin": -903.0,
        "LimMax": -143.27,
        "GlobalRef": 1113
      },
      {
        "$type": "BrAxis",
        "DeviceId": "Spec_RotY",
        "ControllerId": "StageController_BR",
        "AxisName": "SRY",
        "RefMode": "Default",
        "Movement": "RotY",
        "DefaultVelocity": 20,
        "DefaultAcceleration": 40,
        "LimMin": -72000,
        "LimMax": 72000
      }
    ]
  },
  "Detectors": [
    {
      "$type": "DetectorIRay",
      "DeviceId": "XRayDetector",
      "WorkDir": "C:\\Users\\CT\\Desktop\\iRay\\Tools\\iDetector\\x64\\work_dir\\NDT1717HS",
      "Flip90ClockW": -1,
      "BitDepth": 16,
      "DetectorModes": [
        {
          "Description": "1x1 Binning",
          "ImgWidth": 3072,
          "ImgHeight": 3060,
          "PixelSize": 139.0,
          "BinX": 1,
          "BinY": 1
        },
        {
          "Description": "2x2 Binning",
          "ImgWidth": 1536,
          "ImgHeight": 1530,
          "PixelSize": 278.0,
          "BinX": 2,
          "BinY": 2
        }
      ]
    }
  ],
  "Sources": [
    {
      "$type": "TestSource",
      "DeviceId": "XRaySource",
      "MaxCurrent": 200
    }
  ],
  "Startup": [
    {
      "DeviceId": "BrPlc"
    },
    {
      "DeviceId": "StageController"
    },
    {
      "DeviceId": "StageController_BR"
    },
    {
      "DeviceId": "Det_TransZ"
    },
    {
      "DeviceId": "Spec_RotY"
    },
    {
      "DeviceId": "Spec_TransX"
    },
    {
      "DeviceId": "Spec_TransZ"
    },
    {
      "DeviceId": "XRaySource"
    },
    {
      "DeviceId": "XRayDetector"
    }
  ]
}
